Date,Activity Name,Category,Location,Phone Number,Website,Description,Best Season
1/11/2026,June Lake Loop Scenic Drive,Scenic Drive,June Lake Loop,+1 (760) 648-7584,www.junelakeloop.org,16-mile scenic loop with four alpine lakes,Spring-Fall
1/11/2026,Gull Lake,Water Sports,June Lake Loop,+1 (760) 648-7584,www.junelakeloop.org,Kayaking and paddle boarding in pristine lake,Summer
1/11/2026,Rush Creek Trail,Hiking,Silver Lake,+1 (760) 648-7584,www.junelakeloop.org,Access to Ansel Adams Wilderness,Summer
1/11/2026,June Mountain Skiing,Winter Sports,June Mountain,+1 (888) 586-3686,www.junemountain.com,Family-friendly ski resort with stunning views,Winter
1/11/2026,Oh! Ridge Trail,Hiking,June Lake,+1 (760) 648-7584,www.junelakeloop.org,Moderate 2.5 mile loop with lake views,Spring-Fall
