Date,Activity Name,Category,Location,Phone Number,Website,Description,Best Season
1/11/2026,Mammoth Mountain Skiing,Winter Sports,Mammoth Mountain,+1 (800) 626-6684,www.mammothmountain.com,World-class skiing and snowboarding with over 3500 acres,Winter
1/11/2026,Devils Postpile,Hiking,Devils Postpile National Monument,+1 (760) 934-2289,www.nps.gov/depo,Unique columnar basalt formations and Rainbow Falls,Summer
1/11/2026,Convict Lake,Water Sports,Convict Lake,+1 (760) 924-5500,www.convictlake.com,Kayaking and fishing in stunning alpine lake,Spring-Fall
1/11/2026,Lakes Basin Hike,Hiking,Mammoth Lakes Basin,+1 (760) 924-5500,www.visitmammoth.com,Explore multiple alpine lakes on scenic trails,Summer
1/11/2026,Hot Creek Geological Site,Nature,Hot Creek,+1 (760) 924-5500,www.fs.usda.gov,Natural hot springs and geothermal features,Year-round
